Лог работы tcpdump:

$ sudo tcpdump dst 172.16.27.126 or src 172.16.27.126
...
12:22:07.578874 IP 172.16.27.179.59810 > 172.16.27.126.8000: UDP, length 8
12:22:07.579144 IP 172.16.27.126.8000 > 172.16.27.179.59810: UDP, length 512
12:22:07.579210 IP 172.16.27.179.59810 > 172.16.27.126.8000: UDP, length 8
12:22:07.579552 IP 172.16.27.126.8000 > 172.16.27.179.59810: UDP, length 512
12:22:07.579613 IP 172.16.27.179.59810 > 172.16.27.126.8000: UDP, length 8
12:22:07.579962 IP 172.16.27.126.8000 > 172.16.27.179.59810: UDP, length 512
12:22:07.580036 IP 172.16.27.179.59810 > 172.16.27.126.8000: UDP, length 8
12:22:07.580371 IP 172.16.27.126.8000 > 172.16.27.179.59810: UDP, length 512
12:22:07.580430 IP 172.16.27.179.59810 > 172.16.27.126.8000: UDP, length 8
12:22:07.580781 IP 172.16.27.126.8000 > 172.16.27.179.59810: UDP, length 512
12:22:07.580840 IP 172.16.27.179.59810 > 172.16.27.126.8000: UDP, length 8
12:22:07.581192 IP 172.16.27.126.8000 > 172.16.27.179.59810: UDP, length 512
12:22:07.581249 IP 172.16.27.179.59810 > 172.16.27.126.8000: UDP, length 8
12:22:07.581600 IP 172.16.27.126.8000 > 172.16.27.179.59810: UDP, length 512
12:22:07.581656 IP 172.16.27.179.59810 > 172.16.27.126.8000: UDP, length 8
12:22:07.582010 IP 172.16.27.126.8000 > 172.16.27.179.59810: UDP, length 512
12:22:07.582067 IP 172.16.27.179.59810 > 172.16.27.126.8000: UDP, length 8
12:22:07.582419 IP 172.16.27.126.8000 > 172.16.27.179.59810: UDP, length 512
12:22:07.582476 IP 172.16.27.179.59810 > 172.16.27.126.8000: UDP, length 8
12:22:07.582829 IP 172.16.27.126.8000 > 172.16.27.179.59810: UDP, length 512
12:22:07.582885 IP 172.16.27.179.59810 > 172.16.27.126.8000: UDP, length 8
12:22:07.583238 IP 172.16.27.126.8000 > 172.16.27.179.59810: UDP, length 512
12:22:07.583306 IP 172.16.27.179.59810 > 172.16.27.126.8000: UDP, length 8
12:22:07.583648 IP 172.16.27.126.8000 > 172.16.27.179.59810: UDP, length 512
12:22:07.583704 IP 172.16.27.179.59810 > 172.16.27.126.8000: UDP, length 8
12:22:07.584057 IP 172.16.27.126.8000 > 172.16.27.179.59810: UDP, length 512
12:22:07.584125 IP 172.16.27.179.59810 > 172.16.27.126.8000: UDP, length 8
12:22:07.584467 IP 172.16.27.126.8000 > 172.16.27.179.59810: UDP, length 512
12:22:07.584524 IP 172.16.27.179.59810 > 172.16.27.126.8000: UDP, length 8
12:22:07.584877 IP 172.16.27.126.8000 > 172.16.27.179.59810: UDP, length 512
12:22:07.584931 IP 172.16.27.179.59810 > 172.16.27.126.8000: UDP, length 8
12:22:07.585286 IP 172.16.27.126.8000 > 172.16.27.179.59810: UDP, length 512
12:22:07.585352 IP 172.16.27.179.59810 > 172.16.27.126.8000: UDP, length 8
12:22:07.585696 IP 172.16.27.126.8000 > 172.16.27.179.59810: UDP, length 512
12:22:07.585761 IP 172.16.27.179.59810 > 172.16.27.126.8000: UDP, length 8
12:22:07.586105 IP 172.16.27.126.8000 > 172.16.27.179.59810: UDP, length 512
12:22:07.586170 IP 172.16.27.179.59810 > 172.16.27.126.8000: UDP, length 8
12:22:07.586515 IP 172.16.27.126.8000 > 172.16.27.179.59810: UDP, length 512
12:22:07.586581 IP 172.16.27.179.59810 > 172.16.27.126.8000: UDP, length 8
12:22:07.586925 IP 172.16.27.126.8000 > 172.16.27.179.59810: UDP, length 512
12:22:07.586981 IP 172.16.27.179.59810 > 172.16.27.126.8000: UDP, length 8
12:22:07.587335 IP 172.16.27.126.8000 > 172.16.27.179.59810: UDP, length 512
12:22:07.587401 IP 172.16.27.179.59810 > 172.16.27.126.8000: UDP, length 8
12:22:07.587744 IP 172.16.27.126.8000 > 172.16.27.179.59810: UDP, length 512
12:22:07.587802 IP 172.16.27.179.59810 > 172.16.27.126.8000: UDP, length 8
12:22:08.741023 ARP, Request who-has 172.16.27.126 tell 172.16.27.179, length 28
12:22:08.741244 ARP, Reply 172.16.27.126 is-at 00:80:e1:11:11:11 (oui Unknown), length 46
<зависание>


Лог работы Визуализатора:

$ ./main.py 
...
req 0
ans 0
req 1
ans 1
req 2
ans 2
req 3
ans 3
req 4
ans 4
req 5
ans 5
req 6
ans 6
req 7
ans 7
req 8
ans 8
req 9
ans 9
req 10
ans 10
req 11
ans 11
req 12
ans 12
req 13
ans 13
req 14
ans 14
req 15
ans 15
req 16
ans 16
req 17
ans 17
req 18
ans 18
req 19
ans 19
req 20
ans 20
req 21
ans 21
req 22
<зависание>


